{
  "contract_version": "five-quantity-submission-v2",
  "message_type": "five_quantity_submission",
  "message_id": "11111111-1111-4111-8111-111111111111",
  "correlation_id": "11111111-1111-4111-8111-111111111111",
  "causation_id": null,
  "idempotency_key": "mine-qy-001.2026-07-31.r1",
  "revision": 1,
  "predecessor": null,
  "created_at": "2026-08-01T00:05:00Z",
  "sender": {
    "system_id": "agent-mine-qy-001",
    "party_id": "operator-qy-001",
    "role": "enterprise_agent"
  },
  "recipient": {
    "system_id": "mineguard-qinyuan",
    "party_id": "regulator-qinyuan",
    "role": "regulatory_platform"
  },
  "mine_id": "MINE-QY-001",
  "payload": {
    "mine": {
      "mine_id": "MINE-QY-001",
      "mine_name": "示例一号煤矿",
      "operator_id": "operator-qy-001",
      "operator_name": "示例一号煤业有限公司"
    },
    "reporting_month": "2026-07",
    "timezone": "Asia/Shanghai",
    "period_start": "2026-07-29",
    "period_end": "2026-07-31",
    "closed_at": "2026-08-01T00:00:00Z",
    "comparison_context": {
      "capacity_band": "large",
      "mining_method": "underground-longwall",
      "shift_system": "three-shift-eight-hour",
      "coal_type": "bituminous",
      "operating_regime": "normal-production"
    },
    "days": [
    {
    "date": "2026-07-29",
    "operating_state": "producing",
    "reported_quantity": {
      "daily_total": {
      "ventilation_m3_min": {
        "metric_code": "ventilation_m3_min",
        "value": 8120.5,
        "unit": "m3/min",
        "aggregation": "time_weighted_average",
        "quality_flags": [
          "reported"
        ],
        "source_refs": [
          "SRC-DIRECT-01"
        ]
      },
      "mine_entry_persons": {
        "metric_code": "mine_entry_persons",
        "value": 159,
        "unit": "person",
        "aggregation": "sum",
        "quality_flags": [
          "reported"
        ],
        "source_refs": [
          "SRC-FILE-01"
        ]
      },
      "electricity_kwh": {
        "metric_code": "electricity_kwh",
        "value": 125400,
        "unit": "kWh",
        "aggregation": "sum",
        "quality_flags": [
          "reported"
        ],
        "source_refs": [
          "SRC-DIRECT-01"
        ]
      },
      "detonators_count": {
        "metric_code": "detonators_count",
        "value": 48,
        "unit": "count",
        "aggregation": "sum",
        "quality_flags": [
          "reported"
        ],
        "source_refs": [
          "SRC-FILE-01"
        ]
      },
      "explosives_kg": {
        "metric_code": "explosives_kg",
        "value": 19.2,
        "unit": "kg",
        "aggregation": "sum",
        "quality_flags": [
          "reported"
        ],
        "source_refs": [
          "SRC-FILE-01"
        ]
      },
      "production_t": {
        "metric_code": "production_t",
        "value": 3280.5,
        "unit": "t",
        "aggregation": "sum",
        "quality_flags": [
          "reported"
        ],
        "source_refs": [
          "SRC-FILE-01"
        ]
      }
      },
      "shifts": {
      "zero_shift": {
        "shift_code": "SHIFT-1",
        "start_at": "2026-07-28T16:00:00Z",
        "end_at": "2026-07-29T00:00:00Z",
        "measurements": {
          "ventilation_m3_min": {
            "metric_code": "ventilation_m3_min",
            "value": 8050,
            "unit": "m3/min",
            "aggregation": "time_weighted_average",
            "quality_flags": [
              "reported"
            ],
            "source_refs": [
              "SRC-DIRECT-01"
            ]
          },
          "mine_entry_persons": {
            "metric_code": "mine_entry_persons",
            "value": 80,
            "unit": "person",
            "aggregation": "sum",
            "quality_flags": [
              "reported"
            ],
            "source_refs": [
              "SRC-FILE-01"
            ]
          },
          "electricity_kwh": {
            "metric_code": "electricity_kwh",
            "value": 62000,
            "unit": "kWh",
            "aggregation": "sum",
            "quality_flags": [
              "reported"
            ],
            "source_refs": [
              "SRC-DIRECT-01"
            ]
          },
          "detonators_count": {
            "metric_code": "detonators_count",
            "value": 24,
            "unit": "count",
            "aggregation": "sum",
            "quality_flags": [
              "reported"
            ],
            "source_refs": [
              "SRC-FILE-01"
            ]
          },
          "explosives_kg": {
            "metric_code": "explosives_kg",
            "value": 9.6,
            "unit": "kg",
            "aggregation": "sum",
            "quality_flags": [
              "reported"
            ],
            "source_refs": [
              "SRC-FILE-01"
            ]
          },
          "production_t": {
            "metric_code": "production_t",
            "value": 1600,
            "unit": "t",
            "aggregation": "sum",
            "quality_flags": [
              "reported"
            ],
            "source_refs": [
              "SRC-FILE-01"
            ]
          }
        }
      },
      "eight_shift": {
        "shift_code": "SHIFT-2",
        "start_at": "2026-07-29T00:00:00Z",
        "end_at": "2026-07-29T08:00:00Z",
        "measurements": {
          "ventilation_m3_min": {
            "metric_code": "ventilation_m3_min",
            "value": 8191,
            "unit": "m3/min",
            "aggregation": "time_weighted_average",
            "quality_flags": [
              "reported"
            ],
            "source_refs": [
              "SRC-DIRECT-01"
            ]
          },
          "mine_entry_persons": {
            "metric_code": "mine_entry_persons",
            "value": 79,
            "unit": "person",
            "aggregation": "sum",
            "quality_flags": [
              "reported"
            ],
            "source_refs": [
              "SRC-FILE-01"
            ]
          },
          "electricity_kwh": {
            "metric_code": "electricity_kwh",
            "value": 63400,
            "unit": "kWh",
            "aggregation": "sum",
            "quality_flags": [
              "reported"
            ],
            "source_refs": [
              "SRC-DIRECT-01"
            ]
          },
          "detonators_count": {
            "metric_code": "detonators_count",
            "value": 24,
            "unit": "count",
            "aggregation": "sum",
            "quality_flags": [
              "reported"
            ],
            "source_refs": [
              "SRC-FILE-01"
            ]
          },
          "explosives_kg": {
            "metric_code": "explosives_kg",
            "value": null,
            "unit": "kg",
            "aggregation": "sum",
            "quality_flags": [
              "missing",
              "source_format_warning"
            ],
            "source_refs": [
              "SRC-FILE-01"
            ]
          },
          "production_t": {
            "metric_code": "production_t",
            "value": 1680.5,
            "unit": "t",
            "aggregation": "sum",
            "quality_flags": [
              "reported"
            ],
            "source_refs": [
              "SRC-FILE-01"
            ]
          }
        }
      },
      "four_shift": {
        "shift_code": "SHIFT-3",
        "start_at": "2026-07-29T08:00:00Z",
        "end_at": "2026-07-29T16:00:00Z",
        "measurements": {
          "ventilation_m3_min": {
            "metric_code": "ventilation_m3_min",
            "value": null,
            "unit": "m3/min",
            "aggregation": "time_weighted_average",
            "quality_flags": ["missing"],
            "source_refs": ["SRC-DIRECT-01"]
          },
          "mine_entry_persons": {
            "metric_code": "mine_entry_persons",
            "value": null,
            "unit": "person",
            "aggregation": "sum",
            "quality_flags": ["missing"],
            "source_refs": ["SRC-FILE-01"]
          },
          "electricity_kwh": {
            "metric_code": "electricity_kwh",
            "value": null,
            "unit": "kWh",
            "aggregation": "sum",
            "quality_flags": ["missing"],
            "source_refs": ["SRC-DIRECT-01"]
          },
          "detonators_count": {
            "metric_code": "detonators_count",
            "value": null,
            "unit": "count",
            "aggregation": "sum",
            "quality_flags": ["missing"],
            "source_refs": ["SRC-FILE-01"]
          },
          "explosives_kg": {
            "metric_code": "explosives_kg",
            "value": null,
            "unit": "kg",
            "aggregation": "sum",
            "quality_flags": ["missing"],
            "source_refs": ["SRC-FILE-01"]
          },
          "production_t": {
            "metric_code": "production_t",
            "value": null,
            "unit": "t",
            "aggregation": "sum",
            "quality_flags": ["missing"],
            "source_refs": ["SRC-FILE-01"]
          }
        }
      }
      }
    }
    },
    {
      "date": "2026-07-30",
      "operating_state": "maintenance",
      "reported_quantity": {
        "daily_total": {
          "ventilation_m3_min": {"metric_code": "ventilation_m3_min", "value": 7900, "unit": "m3/min", "aggregation": "time_weighted_average", "quality_flags": ["reported"], "source_refs": ["SRC-DIRECT-01"]},
          "mine_entry_persons": {"metric_code": "mine_entry_persons", "value": 120, "unit": "person", "aggregation": "sum", "quality_flags": ["reported"], "source_refs": ["SRC-FILE-01"]},
          "electricity_kwh": {"metric_code": "electricity_kwh", "value": 89400, "unit": "kWh", "aggregation": "sum", "quality_flags": ["reported"], "source_refs": ["SRC-DIRECT-01"]},